order_id,bucket,original,translated
6e55e4357294c390e20e59615b237026,8-14天,"Ainda não irei avaliar ,pois estou aguardando a entrega de todos os pedidos , após receber eu faço uma nova avaliação",我暂时不会评价，因为我正在等待所有订单交付，收到后我会做新的评价
61fa8d2ee24cc80feecf24ec94c68e8f,15-30天,não me foi informado que produto viria desmontado,我没有被告知该产品将被拆卸
82c5ef9af05ba4775bcabac8b9520c3e,>30天,"até hoje não recebi o produto,já passou do prazo de entrega e nada ainda ",我直到今天才收到产品，已经过了交货日期，但仍然没有任何消息
b2a33016c177ab9b6f09ca324bb26ec6,0-7天,Parabéns para toda equipe.,祝贺整个团队。
4f69ffc6c1340dd48ea12040fdb00af4,>30天,"Ainda não recebi meu produto, não sei porque?
Sempre comprei nas Lojas lannister e entregaram no prazo. A Loja e terceirizada, mais comprei confiando nas Lojas lannister.Espero resposta.","我仍然没有收到我的产品，我不知道为什么？
我一直从兰尼斯特商店买东西，他们准时交货。该商店是外包的，但我是信任兰尼斯特商店购买的。我正在等待回复。"
16378369550d1c3b2b2d3c817db399c9,0-7天,Não tem botão para ajustar o volume.,没有调节音量的按钮。
1a5303d4c0d2c69405f74c3c005a5ea4,0-7天,"Comprei um kit, carrinho, bebê conforto e base para o bebê conforto, só foram entregue o bebê conforto e a base, no status do meu pedido está como si a mercadoria, ""kit, tivesse sido entregue.",我购买了一套套件、婴儿车、婴儿舒适装置和婴儿舒适底座，但仅交付了婴儿舒适装置和底座，我的订单状态显示商品“套件”已交付。
fc303e9e3e6717098dbf0a3484304832,>30天,A entrega esta atrasada.,交货延迟。
1c11d0f4353b31ac3417fbfa5f0f2a8a,15-30天,"não chegaram todos os produtos
está chegando cada dia um, em separado","并非所有产品均已到达
每天都有一个到达，单独到达"
2f3efd5594cd02b721bf3a23bdd52aeb,8-14天,compro sempre,我总是买
89ca1c6fae0e21f0395c0e3b1d89914e,>30天,Produto não chegou e não obrive resposta de nenhuma das duas solicitações que enviei para site da lannister e nem da targaryen. Aguardado resposta.,产品没有到达，我向兰尼斯特或坦格利安网站发送的两个请求也没有得到任何回复。等待回复。
855c2d10e8d3135c6cd5af5dd14d080e,>30天,Muita demora na entrega.,交货延迟很多。
433a9459ece4c6083b2aa89b2480a1a8,8-14天,O prazo encerrou no dia 10/11/2018 e até presente data não foi entregue.,截止日期于2018年10月11日截止，迄今为止尚未交付。
3f237a4d4808dafcc954a7667cd0ad0a,0-7天,"Recebi o produto errado, comprei o BCA MAX EM CÁPSULAS e veio BCA drink líquido, quero fazer a troca urgência",我收到了错误的产品，我买了BCA MAX IN CAPSULES，它附带BCA液体饮料，我想紧急换货
6a0d7306e3f0cccd85e8bffa052d05ac,8-14天,Satisfeito,使满意
731739da258b5bf19d913f4c7dc53a3f,>30天,"além de ter sido muito mal embalado sem nenhuma proteção e por isso chegou completamente danificado, a mesa é bamba e o apoio para o tampo é ruim e fica escorregando, tive que improvisar.",除了包装很差，没有任何保护，这就是为什么它到达时完全损坏，桌子摇摇晃晃，顶部的支撑不好并且不断滑动，我不得不即兴发挥。
5e3eb18fc8a18f4ce40f831b01532b4a,15-30天,"Só não gostei porque os produtos vieram separados, foram faturados e vieram em dias diferentes. Um contratempo. O resto tudo certo",因此，我们必须将不同的产品、不同的产品和不同的产品进行比较。一次挫折。其余的都还好
455283c5e3bdcef4ead05938fa665e79,0-7天,"Relógio mal acabado e frágil, qualidade muito ruim, parece de barraquinha de camelô. Não vale o preço de jeito nenhum.",手表做工很差，很脆弱，质量很差，看起来像街头摊贩。根本不值这个价钱。
e8c92cfd87f5f0c6d2fc5bc1df5f02b4,0-7天,Vieram somente 2 dos 3 itens que pedi,我订购的 3 件商品中只有 2 件到货了。
2ce48a416ec4c72a129f73b550eecdbe,8-14天,Estou aguardando entrega da segunda cuba. Só veio uma.,我正在等待第二个浴缸的交付。只有一个人来了。
337ed97aec5fea9e7e8169cf04876433,15-30天,OEQUIPAMENTO NÃO FUNCIONA. O mini cartao SD nao encaixa e o computador não reconhece quando é conectado com o cabo USB,设备无法工作。 mini SD 卡不适合，用 USB 线连接时电脑无法识别
2780ed1899a2f0138ad85cc24179fa77,0-7天,"Recebi apenas o colágeno no sabor limonada suíça, o outro sabor eu não recebi.",我只收到了瑞士柠檬水口味的胶原蛋白，我没有收到其他口味的。
1a5c3dad7f8ccf75ce213a3726a25af2,15-30天,"eu pedi o cartucho A78 e me entregaram o A85
",我订购了 A78 墨盒，他们给了我 A85
43e99f3020b420b8aff15449ff4f7561,>30天,O prazo não foi cumprido,未达到截止日期
c4c643aeb02923c77740ba7cd42005bb,0-7天,Agora ja recebi o que faltava hoje dia 1 de junho.,现在我今天（6 月 1 日）收到了丢失的东西。
b915355d5d44aa71d50cf04caeb78a53,8-14天,não recebi ainda,我还没收到
119db78602ec4f8cdb8aa475c1fbf655,>30天,Péssima entrega fiz a compra no dia 13/02 e até hoje 18/03 não recebi o produto,交货不佳，我在 02/13 购买，直到今天 03/18，我仍然没有收到产品。
99c8af04316c292e23ca57d8917db2ad,>30天,não recebi as mercadorias até a presente data nem tão satisfação o porquê da demora da entrega no processo pós-venda.,我到目前为止还没有收到货物，也不知道为什么在售后过程中交货时间这么长。
51897b5909b133e69594d2c560115a71,0-7天,"Comprei Escova De Dentes Curaprox Black Edition - Cerdas Pretas. Foi entregue Escova Roxa com cerdas Verdes. 
Nada a ver. E a targaryen, parceira das lannister disse que não pode fazer nada. CORRAM.","我买了 Curaprox 黑色版牙刷 - 黑色刷毛。交付了带有绿色刷毛的紫色刷子。 
没什么可看的。兰尼斯特的搭档坦格利安家族说她无能为力。跑步。"
5cf1acf2432e3672334e331caf413208,>30天,NUNCA MAIS COMPRO NESSA PORCARIA! ,我再也不会买这个垃圾了！
18248821ee955752db5292194e4b6970,15-30天,"Já comprei nas lojas lannister e o produto chegou bem mas rapido, porem o que comprei chegou e por inquanto tá udo bem.",我已经从兰尼斯特商店买过，产​​品很快就到了，但我买的东西到了，到目前为止还好。
140ae5224df379e09df7cdf376070834,0-7天,o relogio ja veio danificado e eu ja entrei em contato para a devolução do mesmo,手表已经损坏，我已经联系您退货了。
2a18b3d0f12775db98aeb028d0e388da,0-7天,O produto é maravilhoso mas pela quantidade não vale a pena,该产品很棒，但就其数量而言，不值得
7c1e94ae4c4305fa26db7da2d6749b36,15-30天,"o produto é bom, porém não resolveu o problema do ronco. Lembrando que não respondi em tempo por que não entendo de computador ",产品虽好，但并没有解决打呼噜的问题。记得因为不懂电脑所以没有及时回复
de28a54bc18433e783cbc37da59763e1,8-14天,"Recebi o produto quebrado e sem funcionar. Tentei contato com a empresa, mas não conseguiram localizar meu pedido.",我收到的产品已损坏且无法使用。我尝试联系该公司，但他们无法找到我的订单。
fd18144a7f23df9342113fdc1f130213,0-7天,"Produto veio com defeito, a caixa do relógio solta,sem parafusos. Quero devolução!!",产品到达时有缺陷，表壳松动，没有螺丝。我要退款！！
243204e250173084280239fb8ac74bef,0-7天,"Comprei o Kit Shampo, Óleo, Balm E Pente Para Barba Usebarba. Porém, faltou o pente!!!",我买了 Usebarba 洗发水、油、香膏和胡须梳套装。然而，梳子不见了！
64e7e99b049c3cdd89c7fa89dc162154,>30天,Ate hoje não recebi .,直到今天我还没有收到。
d19ac15d2d6a66a837bc8bff474218b2,15-30天,"Cancelei ha tempos, enviaram mesmo assim e nao estornaram os valores",我前段时间取消了，他们还是寄了，而且没有退还金额。
a51878c7b567d6bb29abf33bbbd80c24,0-7天,Não veio a nota fiscal com o produto,产品未附带发票
b5b411510c27795418ac5808a30054e0,15-30天,Eu só recebi um lustre e comprei dois anota veio dois e só recebi um ,我只收到一盏枝形吊灯，我买了两盏，但到了两盏，我只收到一盏
b02cdf25c3ec98d2a8c9c0906981e3af,8-14天,porque recebi o e mail dizendo que nao iria receber o produto mas no dia sequinte ele apareceu,因为我收到电子邮件说我不会收到产品，但第二天它就出现了
929ccb6e3021ed4afe8860fe50791967,0-7天,O produto veio diferente do que eu pedi paguei frete é tive de ir aos Correios em uma agência muito distante de casa ,该产品与我订购的不同，我支付了运费，而且我必须去离家很远的一家机构的邮局
4516c79ac42f6a567bf4d1209eba2b33,0-7天,Na imagem parece ser uma lâmpada maior e na verdade é a menor e na descrição não vem informando qual tipo de lâmpada. ,在图像中，它看起来是一个较大的灯，实际上它是最小的，并且描述没有说明是什么类型的灯。
cd74cd8f3a1445a29e098dcac4cc8d11,15-30天,Já pedi a troca e não fizeram,我已经要求换货了，他们没有这么做。
41a9892d27af50019d56c037a3256cab,8-14天,Entrega sem problemas.,无问题交付。
ea452bd7da485c9376c3112226d21b25,8-14天,ótimo,出色的
d9ab642e5dd85a1f2bb53c6c546fa575,0-7天,Loja recomendada. Produto de péssima qualidade.,推荐店。产品质量差。
919f7b191b8ebc3ee9ab62e05ae3b2bb,15-30天,"Solicitei a compra das lâminas que no anúncio falam que são da marca PHILIPS, no entanto o produto é falsificado e sem contar a demora para a entrega no qual eu paguei frete e tive q buscar nos correi",我要求购买刀片，广告中说它们来自飞利浦品牌，但该产品是假冒的，更不用说交货延迟，我支付了运费，不得不在邮局取货。
2a903dd5e53423b47484fd2130e2b6c3,15-30天,"Estou esperando há quase um mês, uma falta de respeito ao consumidor",等了快一个月了，不尊重消费者
a90ba85d1c3ec461d94c0a26cbe4d051,8-14天,"O produto enviado não chega nem perto das bordas, mesmo sendo edge e sabendo que não era abaulado. Não recomendo ninguém a comprar. Voi tentar trocar. Se não vai ser dinheiro jogado fora.",发送的产品甚至没有接近边缘，即使它是边缘并且我知道它没有凸出。我不建议任何人购买。我会尝试交换。不然钱就白花了。
df61cd26aece2f40eb66883de3a81e1f,>30天,O produto não chegou ainda,产品尚未到达
9a40c467105246b59eb5dfa3f5b04539,8-14天,"Não recebi o produto na quantidade adquirida, pois somente uma embalagem (pote) invés de duas.",我没有收到购买数量的产品，因为只有一包（罐）而不是两包。
15ccd194a9fbbf9a0f31cfbf5c6677b7,15-30天,Não é dos melhores. ,这不是最好的。
b2250cc556e74e210e38451b309e63e6,8-14天,"Já tenho experiência com outro esfregão.
Esta marca de produto eu não recomendaria, pois a trava do esfregão é muito dura e não funciona direito.
","我已经有使用另一把拖把的经验了。
我不会推荐这个品牌的产品，因为拖把锁很硬并且无法正常工作。"
81c2d284094f3b39baddefb519a30149,15-30天,UM DOS PRODUTOS (ENTREGA02) COMPRADOS NESTE PEDIDO NAO RECEBI AINDA E OUTRO (ENTREGA01) RECEBI EMAIL QUE ESTA COM DIFICULDADES NA ENTREGA E NÃO TIVE MAIS NOTICIAS ,我还没有收到此订单中购买的其中一个产品 (Delivery02)，而另一个产品 (Delivery01) 我收到一封电子邮件，告知我在交付时遇到困难，但我还没有收到更多消息
1539c0a503a87cb20a5d11a435149b2a,8-14天,Foi vendido um produto como sendo original e veio uma imitação.,一件产品作为正品出售，但收到了一件仿制品。
93ef5624aaaeded1aa197fd63116d902,0-7天,bom produto,好产品
6f93bc498e872d1fceb5926df3b9bd54,0-7天,"Pelo preço, mercadoria compatível.",对于价格，兼容的商品。
96519c210f6dfe22f8e85cad134443ae,0-7天,comprei dois perfumes sendo que só veio um na caixa e pra ajudar o perfume e falsificado e marcado na caixa venda proibida que e só pra teste,我买了两支香水，但盒子里只有一支，帮帮忙，这瓶香水是假货，盒子上标有禁止销售的字样，仅供测试用
bd859dd7a6a1b8c1df9fcb75c3604eaf,8-14天,bom,好的
0572a001d46280ab9ab95964665ff768,0-7天,A caneta espiã não funciona queria que vocês manda se outra para mim pôquer que vocês mandou não funciona não carrega não posso ficar com ela sim ,间谍笔坏了，我想让你再给我寄一个，你寄的扑克坏了，它不会充电，我不能保留它，是的。
1c8e6591884dc005a896f84dfb6008ff,>30天,Produto ainda não entregue,产品尚未交付
6a0633b045fa76bef36ac14dd4a3f165,8-14天,"Comprei duas torres de cerveja, a transportadora só me entregou uma embalagem e que só tinha uma torre dentro, estou muito insatisfeita!",我买了两塔啤酒，运输公司只给了我一个包裹，里面只有一塔，我很不满意！
b6fa3751148ad8ba139779f6543951d9,0-7天,"o produto é bonito, mas muito frági,l chegou bem amassado.",该产品很漂亮，但非常脆弱，到达时非常破碎。
6283d2cb264f76928dffd1faf0f5ff33,15-30天,recebi o produto errado nunca tinha acontecido isso estou acostumada a comprar tudo pra minha casa online escolhi um tapete liso e veio um super diferente do que escolhi agora quero ver como vai ser .,我收到了错误的产品，这种情况以前从未发生过，我习惯在网上购买家里的所有东西，我选择了一张普通的地毯，但收到了一张与我选择的完全不同的地毯，现在我想看看它会是什么样子。
0ca8999f0176e37f35b6e49a9b2569da,15-30天,"PEDIDO APROVADO DIA 06/10, POR DEMORA CANCELAMENTO DO PEDIDO NO DIA 17/10 E MESMO ASSIM MANDAM A MERCADORIA. ESTOU TENTANDO, DESDE O DIA 20/10 CONTATO VIA stark MAS NÃO OBTENHO RESPOSTA/RETORNO.",由于 10 月 17 日取消订单延迟，订单于 10 月 6 日获得批准，但即便如此，他们还是发送了货物。自 10 月 20 日以来我一直在尝试通过 stark 联系，但我没有回复/回复。
e422e79c353461906ac09d654bd28ad7,>30天,Produto não entregue,产品未交付
574e38ca454c86f60df545b65a03277d,0-7天,"A garrafinha não possui 1,5 L conforme anunciado, nem se encher até a tampa! E o material também não é lá essas coisas, para mim não valeu o preço pago.",瓶子不是宣传的 1.5 升，也没有装满瓶盖！而且材料也不是那么好，对我来说不值得付出的代价。
a383762bd79949e1b34878460042cd23,15-30天,"Comprei 2 unidades. Apos atraso na entrega , recebi apenas 1 unidade. O grave é que o produto vem em embalagem individual e com nota fisc que aponta na nota fiscal 2 unidades. Recebi ontem com atras",我买了 2 件。由于交货延迟，我只收到了 1 件。严重的是，该产品采用单独​​包装，并附有发票上注明 2 单位的税单。我昨天迟到了
fec2c513cc9c10087af9e5d8f2da71fd,8-14天,"produto com aparência de usado, tinta da logo gasta e com alguns arranhões, não tente economizar 5 reais comprando por essa loja.",产品看起来是二手的，标志油漆已经磨损并且有一些划痕，不要试图从这家商店购买以节省 5 雷亚尔。
ae06ecd5e96edbfc44668e2cd8e0ff84,>30天,"Produto chegou com defeito na pulseira, entrei em contato pra fazer a troca e até agora não me responderam. Demorou pra chegar, e eu tive que fazer retirada nos correios, não entregaram em minha casa.",产品到达时手环有缺陷，我联系他们进行换货，但到目前为止他们还没有回复我。花了一段时间才到，我必须去邮局取，他们没有送到我家。
4e26917edee71b496c27c12c72640436,8-14天,Trabalhem para reduzir o prazo de entrega. Não sei se compraria novamente através do site.,努力缩短交货时间。我不知道我是否会再次从该网站购买。
244eddf1bb79ed749213ea45709f87cc,8-14天,"Mandaram o relógio, ao chegar observei que estava parado.
Conclusão :
Mandaram produto quebrado.
","他们送来了手表，当我到达时，我发现它已经停了。
结论 ：
他们寄来了损坏的产品。"
7a242c07bdf25150ab522513760d6b8b,8-14天,Recebi apenas um produto de dois que comprei e este veio com vários defeitos demonstrando ser um produto de baixa qualidade ,我购买的两件产品中只收到了一件，它有几个缺陷，证明是低质量的产品。
28a132c45555139dcd554dfcf6d21ef9,0-7天,Qualidade do produto é ruim. ,产品质量不好。
04f1689642ed3c3e45244d4f7b2fe731,8-14天,"O produto que veio não é o que eu comprei, inclusive a nota fiscal veio em nome de outra pessoa, e não consigo contato para resolver o problema",收到的产品不是我买的，包括发票是别人的名字，我无法联系他们解决问题
5f3ce710839dcf62389d5187ece2d4e8,0-7天,"Fiz a compra de 2 conjuntos, e apesar de constar na nota fiscal os 2, somente 1 conjunto foi enviado no pacote. Quero meu outro conjunto. ",我购买了 2 套，尽管发票上都列出了，但包裹中只寄出了 1 套。我想要我的另一套。
1f11f0ab2b0ec59d0ec45f7f810a04f8,8-14天,"Nunca tive problemas com stark.com, mas infelizmente dessa vez errou mesmo. Pedi uma mangueira de entrada de água e recebi uma mangueira de saída. ",我从来没有在stark.com上遇到过问题，但不幸的是这一次它真的犯了一个错误。我订购了进水软管并收到了出水软管。
4273d1dff20ccc8e3abbbb34e4a50b62,8-14天,"Comprei e em seguida vi que nao era o cassete com 10v, cancelei em menos de 15 minutos após a compra e mesmo assim enviaram o produto",我买了它，然后发现它不是 10v 卡式磁带，我在购买后不到 15 分钟就取消了它，他们仍然发送了产品
e0324d1696ac7872c9dcc6ea30afad20,0-7天,"PRODUTO BONITO, MAS ACHO QUE DEVERIA TER VINDO NUMA CAIXA ADEQUADA P RELOGIO.",漂亮的产品，但我认为它应该装在适合 RELOGY 的盒子里。
56f1d06ce4c0cf8a60c9d1af768f39de,>30天,"o meu pedido estava para ser entregue até 15/08/2018, mas até agora não recebi.",我的订单原定于 2018 年 8 月 15 日送达，但我还没有收到。
eca71337cf21604694b68488edfa6d86,0-7天,O produto veio errado preciso devolver já entrei em contato mas até agora obtive nenhum retorno,产品到达错误，我需要退货，我已联系您，但到目前为止我没有收到回复。
0cc4f59df564ec8dd6539dfdd8b29472,0-7天,A Ducha chegou sem o desviador que consta na foto. Já reclamei no SAC da KDT emissor da Nota Fiscal no dia 07/03/2018 e ate o momento nada foi resolvido. Favor tomar providencias.,淋浴到达时没有照片中所示的分水器。我已于 2018 年 3 月 7 日向开具发票的 KDT SAC 提出投诉，但到目前为止尚未得到解决。请您做好安排。
75f1f96566e2fbecc5fe22dd4f16f8e8,>30天,Demorando muito a entrega,交货时间太长
59bdbeeec9cd5173e5b9e86dcb9bce0c,0-7天,"o produto veio levemente avariado, provavelmente por pressão na embalagem durante a remessa.
Mas está funcionando normalmente.","产品到达时略有损坏，可能是由于运输过程中包装受到压力造成的。
但它工作正常。"
7d95043be17107a139c484021f39a8a5,15-30天,Ainda não recebo e não sei o motivo,我还是没有收到，也不知道为什么
057bc88d7845bc736fbe1fb27f2932f2,0-7天,"Não cancelaram meu pedido na data certa, agora tenho que levar no correio",他们没有按时取消我的订单，现在我必须把它带到邮局
4a15babdb3e9f7216ea0fa4ab6b5ba8e,8-14天,"Prezados minha encomenda era do produto waterpik 110 v e foi entregue o produto em 220 v. Como procedo a troca ? 
Atenciosamente
Flavio","亲爱的大家，我的订单是waterpik 110 v 产品，而产品是220 v 交付的。我该如何换货？ 
此致
弗拉维奥"
89ab5609dfc901cc9824e0a62cbefe59,>30天,Ainda não recebi o meu produto o prazo de entrega era até 23/03 e até agora não chegou.,我还没有收到我的产品，交货截止日期是 03/23，但尚未到达。
03ba490d83feaba677aede829ff79db1,>30天,"Bom dia, meu nome é Ana Paula Amancio, e ainda não recebi meu produto,. Peço que me dê uma posição , pois já faz muito tempo que comprei. Sei que devido a greve dos caminhoneiros tudo estava parado.",早上好，我的名字是 Ana Paula Amancio，我还没有收到我的产品。我请求您给我一个位置，因为我已经很久没有购买它了。我知道，由于卡车司机罢工，一切都陷入了停滞。
f40b59109981de2b6d38eb4f42033102,>30天,"Fiz uma compra de uma Cortina Jade Quarto e Sala 2,00m x 1,70m para Varão Simples no começo de dezembro e ate agora não recebi o produto sendo q estava previsto para chegar ate o dia 
28/12.","我在 12 月初购买了一套用于卧室和客厅的玉质窗帘 2.00m x 1.70m，用于一根简单的杆，直到现在我还没有收到该产品，尽管它预计会在当天到达 
12/28。"
3f752ac8c1676fac14b0fdc9dc26539a,0-7天,"relógio não tem caixa ? veio muito bem embalado, mas sem caixa ?",手表没有盒子吗？包装很好，但是没有盒子？
3b81b7af81e2eeda1442ed880cd1d860,15-30天,"Efetuado a compra dia 16/02 aprovado dia 20/02, emitido a nota 22/02 mto tempo para processo de analise e envio e ate o dia 08/03 não recebi o produto",16/02购买，20/02批准，22/02发出通知，分析和运输过程花了很长时间，直到03/08我还没有收到产品
051fcda88d997d3ff86012da2a556342,0-7天,É couro sintético!!,是合成皮革！！
0030d783f979fbc5981e75613b057344,>30天,"Comprei dois produtos no mesmo dia, sexta-feira de black friday, no início de dezembro. O jogo de panelas tramontina chegou dentro do prazo, que era até o dia 11-12, mas a pipoqueira ainda não chegou.",我在十二月初的黑色星期五同一天购买了两种产品。 Tramontina 炊具套装准时到达，即 11 日至 12 日，但爆米花机还没有到达。
bca45e92990f2f54a8aed374b160f2e8,0-7天,"Recebi a película e ela veio toda lacrada, porém no momento de colocá-la estava com problemas, riscos na tela e falta de cola em torno, ou seja, produto de má qualidade. ",我收到了贴膜，它是完全密封的，但是当我贴上它时，出现了问题，屏幕上有划痕，周围没有胶水，换句话说，这是一个质量很差的产品。
f16290559c863b848c56bd040fe3831c,>30天,nao recebi o produto,我没有收到产品
dda0996054bec18cafa1ede0d62dd3cb,0-7天,Nao recebi os produtos,我没有收到产品
4f2d72bec3f76b37047967ded26335f2,15-30天,"Foi enviado produto Diferente daquele do anúncio. Solicitei devolver o produto e receber o valor pago, porém ainda não tive resposta. Espero resolver este desagradável problema de forma consensual.",发送的产品与广告中的产品不同。我要求退回产品并收到付款，但尚未收到回复。我希望以协商一致的方式解决这个不愉快的问题。
6e4064c4b1df562463ea9a75839db134,8-14天,"Quanto a entrega , tudo bem . Mas o perfume não gostei , muito fraco. Fragrância muito diferente das opiniões que li na internet . ",至于交货，一切都很好。但我不喜欢这款香水，味道很淡。香水与我在互联网上看到的意见非常不同。
87fd335973d9705b9c82ee68d314a8c5,0-7天,Meu produto constar que foi entregue mais não chegou nada na minha casa e hoje de manhã eu liguei na central da lannister pra saber o que aconteceu e atendente? mim informou pra ey esperar até terça ,我的产品说已交付，但没有任何东西到达我家，今天早上我打电话给兰尼斯特中心，了解发生了什么事以及服务员？我被告知要等到星期二
e2df710c10b3d255c51ae1fb11bfcd11,8-14天,Comprei 3 itens... recebi apenas 2... e a loja não responde meus contatos...,我买了 3 件商品...我只收到 2 件...商店没有回复我的联系方式...
ae940b7edae45de05e43817ff84efbfc,15-30天,"O Produto veio avariado. A caixa do mesmo muito amassada, com alguns rasgos e cheia de fita adesiva. E o produto veio sem uma das rodas. Já mandei vários e-mails para a stark e não tive retorno...",产品到达时已损坏。盒子非常凹痕，有一些撕裂，并且贴满了胶带。而且该产品没有一个轮子。我已经给斯塔克发了几封电子邮件，但没有收到回复......
a4052a184e5a78c6be9f09a9fed53279,15-30天,Atraso na entrega,交货延迟
cadf2edfaac0597d9c8575252b0415aa,15-30天,Recebi o littman de cor errada,我收到了错误的颜色 littman
e2aa3c8ad14a870e32ae9718c84e0567,>30天,"Fazem entrega em horário comercial. Nesse período, estamos trabalhando para pagar o que encomendamos ",他们在营业时间内送货。在此期间，我们正在努力支付我们订购的商品
9fa2ad63a061c20fb72179b9d79bafd3,0-7天,"Comprei um kit com 2 pomadas e recebi apenas uma, Já enviei mensagem e não obtive resposta. Completa falta de respeito.",我买了一套有 2 种药膏的套装，但只收到了一种。我发了一条消息，但没有得到回复。完全缺乏尊重。
1d496c62bf852e069018c2b038064949,>30天,Preciso de uma posição pois não recebi o mesmo.,我需要一个职位，因为我没有得到同样的职位。
3683a64548d4008fcbcd5e9188803b86,15-30天,"Produto conforme anunciado, porém entrega muito demorada, comprei para o dia das mães e chegou depois.",产品如广告所示，但交货速度很慢，我是在母亲节买的，后来才到。
29692492693482bc3acf19d97fac69f8,8-14天,Ainda não entregaram o produto e no site diz que a entrega foi realizada.,他们尚未交付产品，网站上显示已交付。
