order_id,bucket,original,translated
fe3b7d7e6df783d622ae530f841bc87e,0-7天," Infelizmente a embalagem do meu baralho veio rasgada. Vai ser um presente. Vou ter q entregar para o aniversariante rasgado mesmo pois não da mais tempo de trocar. 
 Mas chegou dentro do prazo. ","不幸的是，我的甲板的包装被撕破了。这将是一份礼物。我不得不把它送给撕破的生日男孩，因为我没有时间再换它了。 
 但它准时到达了。"
f2b05b43011210214069c513de56b6b0,8-14天,"A compra desse item me lembra uma música:
""Não era amor era: C I L A D A""","买这个东西让我想起一首歌：
“这不是爱，而是：C I L A DA”"
14363bf0e98e4ac853c49e2e1b316014,15-30天,Não entregaram o pedido,未交付订单
0f29bafaaa77f4548165215b66bd97e4,>30天,"Atraso na entrega sem dar satisfação ao cliente, que com certeza escolheu o produto com cuidado e com as melhores expectativas. Falta de consideração.",交货延迟，客户无法满意，客户当然是带着最好的期望仔细选择了产品。缺乏考虑。
4cb45a7074870ecb5a1f362fd7043178,>30天,"É uma pena não ter chegado antes do Natal
 Espero que chegue até o ano Novo!","可惜圣诞节前没到
 我希望它能在新年到来之前到来！"
c9d9195d49623398b66ac6322f971d5c,8-14天,Entrega rapida,交货快捷
21740bea241f06ee46a7febe29061c31,15-30天,"Estou indignada. É o presente de natal do eu filho ,comprei com antecedência e não chegou. ",我很愤怒。这是我儿子的圣诞礼物，我提前买了，但还没到。
b8b331821864531800f736e470ad836b,15-30天,Comprei o relógio e não veio o que eu pedi e tudo indica que ê falsificado. Não gostei. ,我买了这块手表，但它没有与我订购的产品一起提供，一切都表明它是假冒的。我不喜欢它。
489b4af31f96f42648f0c0636a51b289,8-14天,produto veio diferente do que comprei e ja fiz a devolução ,该产品与我购买的产品不同，我已将其退回
d3cefa3b994d2662eba354f826cd64a7,15-30天,de boas,好的
8aaa4fb6b01346340a6cf91214f6606f,8-14天,recebi um produto que não era o meu,我收到了不属于我的产品
6d631e55b551b20a81767e9685b7afb9,15-30天,"Não sei se foi por causa dos correios, mas o fato é que nem sei se vou receber o produto, pois o lojista não entrou em contato comigo, mesmo após reclamação.",我不知道是否是因为邮局的原因，但事实是我什至不知道我是否会收到产品，因为即使在投诉后零售商也没有联系我。
a6ee9db107e8fd0fc14d99be85503396,15-30天,Meu produto veio errado outro modelo fui trocar não tem mais,我的产品出了问题，我去换了另一个型号，但不再可用
b257713d1922be564a498b7dea2969a8,15-30天,"O produto é otimo, mas a lannister deixa muito a desejar. O produto chegou dentro do prazo, mas era 16 dias de prazo, muito tempo de espera e tambem uns dos produtos veio ERRADO.",该产品很棒，但兰尼斯特还有很多不足之处。产品准时到达，但花了 16 天，漫长的等待，而且有些产品还送错了。
32e4fa9bb468884309b58b9348de70c3,0-7天,"Comprei duas unidades, foi entregue somente uma. ",我买了两套，只送了一套。
5ba96da244b3eb9310e1f91bc3c6acff,15-30天,"DEMORA NA ENTREGA ,PRODUTO RUIM RESUMO NÃO GOSTEI",延迟交货、不良产品摘要我不喜欢它
9de58a725e435fc7ff5d41e6d8691788,15-30天,"Recebi a cadeira correta, porém veio com um pequeno rasgo no parte superior do encosto.",我收到了正确的椅子，但椅背顶部有一个小撕裂。
a8eeef949a97362f253b5d6b9aa7b498,8-14天,"No status esta dizendo que ja foi entregue, agora cade o produto??",状态显示已经发货，请问现在产品在哪里？？
a11f86f65cf0246aa8d08f7a6b60973d,>30天,aguardo resposta de vcs.,我等待你的回复。
320830bbdec047e0eb59a44965450195,8-14天,"O gaveteiro veio com a cor errada, comprei cor rosa pink, tal como abunciada, mas chegou na cor rosa bebê. ",抽屉的颜色不对，我买的是粉红色的，如广告所示，但到货时却是淡粉色。
72002d46bebcafbe621c662f1ad3cc45,8-14天,Compreis os 2 itens só recebi a película de vidro ,我买了 2 件商品，只收到了玻璃膜
7c1c60f422c242e539075d9b9edca95c,8-14天,encomendei e paguei por 2 unidades do produto (Película de vidro 3D Moto X4) e somente uma foi entregue. ,我订购并支付了 2 件产品（Moto X4 3D 玻璃膜），但只交付了一件。
886ddb536ba82bd61a9d3ddbf5d0e73d,8-14天,"bom dia.
efetuei a compra de 4 kits de molas 18cm ( cod. KLJ34634) e chegaram somente 3 kits.

aguardo solução para meu problema","早上好。
我购买了 4 个 18 厘米弹簧套件（代码 KLJ34634），但只到了 3 个套件。

我正在等待我的问题的解决方案"
f3c3a7ba1b89f8248dbb8e42813efad5,0-7天,"Comprei 2 cartuchos e entregaram apenas 1 deles.
Esta unidade está disponível para ser devolvida.
Preciso do reembolso do valor correspondente","我买了2个墨盒，他们只送了1个。
该装置可退货。
我需要退还相应金额"
81101f8021e6efa35db428bbaf886a29,>30天,Bom gostaria muito de receber o produto esa é a primeira vez que isso acontece ,嗯，我真的很想收到这个产品，这是第一次发生这种情况。
d9f8dfc775170aba5d24809cc2c04058,0-7天,nota 10,注10
6b3c0956c89312e2c54f8d1366ecea9a,0-7天,Veio como eu esperava ,正如我所料
1f01fe794c7b4f7066b38ad326c4bfa2,15-30天, EU NÃO GOSTEI DO ATRASO PORQUE ERA PRESENTE DO NATAL,我不喜欢延迟，因为这是圣诞礼物
912d6ebade30677cea365478156ad6d7,8-14天,comprei um relógio chegou outro. quero fazer a troca!,我买了一块手表，另一块到了。我想转行！
aac66aa37e3c8d0fcc9571062fabb261,15-30天,"O produto não é de boa qualidade os blocos não se encaixam direito e qualquer movimento que faz eles já desfazem tudo o que foi montado. 

Uma pena estava esperando por algo melhor. ","该产品质量不好，积木不合适，您所做的任何移动都会破坏组装好的所有东西。 

遗憾的是希望有更好的东西。"
ad5ad3658e7ba2b40e80f791dfb3dbb9,15-30天,"Não recomendo, pois o praso de entrega é muito longo, pois comprei o produto no dia 09/06/2017 e chegou dia 04/07/2017 muita demora, pois compro em outros site e recebo o produto no máximo 10 dias ut.",我不推荐它，因为交货时间很长，因为我在06/09/2017购买了产品，并在07/04/2017到达，花了很长时间，因为我在其他网站上购买并最多在10天内收到产品。
f3100bed66fcc67bf69111059a3aa4ac,0-7天,O produto não aprensentou a mesma qualidade ao da imagem da internet.,该产品的质量与互联网上的图像不同。
628430cb4db23766c1cc5c9d232cf985,>30天,"Estou ha mais de 1 mes esperando meu produto, e se quer tem um número pra falar com um atendente das lannister!! Só gravação 
NUNCA MAIS","我已经等待我的产品超过 1 个月了，如果您愿意，可以拨打兰尼斯特客户服务代表的电话号码！仅录音 
再也不会了"
66866953330f81976a2adcd51f603560,>30天,tive problemas com a entrega a mercadoria não foi entrgue ,我在送货时遇到问题，货物未送达
8436df70c30e8e11edf5cf2f880edf6e,15-30天,"Comprei o mesmo produto , gostaria de devolver.Como faço. ",我买了同样的产品，我想退货。我该怎么做？
5a18318628961a2982d19b5ef6026e2b,15-30天,Produto consta como entregue aos correios do RJ desde o dia 20/03 e ainda não saiu para entrega.,产品似乎自 03/20 起已交付至 RJ 邮局，但尚未发布交付。
b0e779f901eb8bbbc2e223a783dc46a1,0-7天,Regular ,常规的
6a6d3cd77ef3a533edef69dccf6c0de3,15-30天,"Comprei 3 cadeiras, todas vieram faltando peças. nao consegui solicitar troca pelo site, dá erro de conexão. Também não consegui por telefone. soliciitei por e-mail e nao recebi retorno
Insatisfeito ","我买了3把椅子，全部都缺少零件。我无法在网站上请求交换，它给出了连接错误。我也无法通过电话得到它。我通过电子邮件提出请求，但没有收到回复。
不满"
30d069e8fe27dc74e756bbb4f470a361,>30天,Meu produto não chegou e ao rastrear aparece como erro no processo da entrega!!,我的产品没有到达，在跟踪时它显示为交付过程中的错误！
4fcd9b66261e3288dcf98c7d6f6d07da,15-30天,"NÃO GOSTEI DA DEMORA
",我不喜欢延迟
b39ecb6c0af8f006d1bf639d962fb92e,0-7天,"Perfume original, boa fixação, porém a embalagem externa (caixa) é branca e tem apenas o nome do perfume e a escrita ""Tester"" ou seja é para mostruário de lojas, desagradável para presentear...",原厂香水，持久力不错，不过外包装（盒）是白色的，只有香水的名字和“测试者”字样，就是卖场展示用的，送人不太好……
848b0561d4bc26f57b288a5004f38683,0-7天,Não recebi o autotransformador. Os controles foram entregues.,我没有收到自耦变压器。控制权已移交。
60243a953c19e3606e7757264ea2ad3e,8-14天,"Não Gostei da qualidade do produto, muito fino as peças das toalhas, pessima qualidade.",我不喜欢产品的质量，毛巾的碎片很薄，质量很差。
1a449404ebac257b30cbe56e6500d36f,0-7天,produto veio pela metade esta faltando mercadoria,产品到达时已完成一半，商品丢失
1a4ce6e380dae0771ca218753b0739a1,>30天,É uma loja muito boa mais infelizmente demora pra entregar ,很好的一家店，可惜送货时间比较长
63b6bb683b45ebaf42d0979fae65ad35,>30天,Estou aguardando o produto.,我正在等待产品。
a6b7a54fd0db4d3a5d6c9d6af0aae6d1,8-14天,Espero que entregue o jogo de toalha que não veio ,我希望你能把没收到的毛巾套装送过来
d3433b37aa2f57a56e8c97c455ac6ed8,8-14天,Não tinham o produto que comprei...tive que trocar por outro...mas no final seu certo,他们没有我买的产品...我不得不换另一个...但最后还是可以的
c801ee070159af89f5ce2b8c03e9e032,15-30天,Pagamos para a entrega ser feita em nossa residência e não para retirarmos nos Correios.,我们支付的是送货到我们住所的费用，而不是在邮局收取的费用。
7cf158d0e4744ba4ce58e5a9be631f7e,15-30天,"QUERO fazer a devolução. 
Qual procedimento, por favor?","我想退货。 
请问要什么手续？"
b3a70e33f30ddbe86271d2a7e75b62e2,0-7天,Produtos de baixa qualidade.,低质量的产品。
e2005caf6477eb1b0a0bcce785ecbb5d,>30天,Ainda não recebi meu produto... chateada ,我还没有收到我的产品...心烦意乱
146ee0d0528dc62bebbd50fe53f2ec43,15-30天,"O pedido chegou dentro do prazo, a capinha é perfeita, corresponde ao modelo XA1, SONY XPERIA, mas infelizmente a película não corresponde ao modelo. Ficou pequena ",订单准时到达，外壳完美，对应XA1、SONY XPERIA型号，可惜贴膜与型号不对应。变小了
c17d3d6c480b09300d8daa2eb502d060,15-30天,Produto ,产品
e7e206c19879bfaf67b74f8a8740b21e,8-14天,"Não gostei do material do produto,o acabamento é ruim nota-se imperfeições!!!!",我不喜欢产品的材质，表面处理很差，你可以看到瑕疵！！！！
ba81383846b0b6c97b5160f986fa3707,15-30天,Não recebi meu produto ainda,我还没有收到我的产品
89a52f9735ee199f8c4583cd8d77de4c,0-7天,veio errado comprei 2 unidade veio somente 1,买错了，我买了 2 件，只来了 1 件
4e64cd773156febbf0e105d0b4aeaad0,15-30天,"Eu recebi o produto sem o Pistão da cadeira, abri uma solicitação de devolução e foi cancelada pelo vendedor loja, sem nenhum motivo e vou ficar no prejuízo pois não fui atendido.",我收到的产品没有椅子活塞，我提出了退货请求，但商店卖家无缘无故地取消了它，我会因为没有得到答复而不知所措。
04ff62d0684a80831afbdc2f6e56259f,15-30天,Faltou uma peça pra colocar no pé da cadeira.,缺少一块可以放在椅脚上的东西。
1c2f555edfc445e72867c301b68ac512,0-7天,Questionamento: o Relogio é a corda?,问：手表是上弦手表吗？
eba24b2dcc75d6fb248e917715a425d5,0-7天,"Preciso devolver o extensor, porque não coube para fazer o encaixe no meu portão... eu havia comprado no mesmo site e tomei o cuidado de pegar no mesmo modelo, mas era totalmente diferente. o que faço",我需要退回延长器，因为它不适合我的门...我在同一个网站上购买了它，并小心翼翼地购买了相同的型号，但它完全不同。我该怎么办
ce678bd6591f2487c9b4f5af45b4619f,8-14天,"Realizei outras compras pela internet em datas posteriores a esta compra e já recebi os produtos.
logística deixa a desejar.","我在这次购买之后还进行了其他网上购买，并且已经收到了产品。
物流还有待改进。"
899a5ec4b50c53b46fc876182c9cecab,15-30天,POXA SO QUERIA MEU PRODUTO ,哇，我只是想要我的产品
661620f1b2ab6bd136e9566f2188c215,0-7天,"Fiz uma compra que constavam dois relógios . Só recebi um relógio muito fraco , nível de camelô, nem em caixa veio , dentro de um saco de tecido. ",我购买了包含两块手表的商品。我只收到了一块非常弱的手表，街头小贩级别的，它甚至没有装在盒子里，放在布袋里。
0f559863677fb17eed36c4374e198a93,15-30天,"Ate o momento alnada do meu pruduto, gostaria de saber quando que vou receber...",现在我想知道什么时候能收到...
e78e6c2d9d913cda60562cd825c90374,8-14天,Recebi o relógio cronometro mas não recebi a argola olímpica.,我收到了天文台手表，但没有收到奥运五环。
8f22b4b97d1fd2f187f3106ffb0021c4,8-14天,Não posso comentar pois ainda não recebi nada,我无法发表评论，因为我还没有收到任何东西。
7d316b369d4c6b0a4ebeebbff5f65466,0-7天,Compramos 6 unidades e foi entregue apenas 1 ,我们购买了 6 件，但只交付了 1 件
f6f6a68d78c7dd4b319f6df3c846094b,8-14天,Não passou o prazo ainda.,截止日期还没有过去。
6d9ce5b5461904a50d649dd753f6b5a1,15-30天,"Produto resistente, gostei do design ótimo preço ",坚固的产品，我喜欢的设计，价格优惠
a49ef06443dbe442d78f3fa3b26848d2,>30天,Quero o cancelamento. ,我想要取消。
1a1aa9714d0f88e8a2b20b0c7c037d0b,8-14天,"APESAR DE TER CUMPRIDO PRAZO DE ENTREGA, NÃO RECEBI O PRODUTO CONFORME NF",尽管已经到了交货期限，但我没有收到 NF 的产品
f4f8aa5fb2ceaeb486500d9a7926a272,8-14天,"Não foi entregue o produto 
",产品未交付
6d73ecf533649a9f6e32b3c803c76e57,15-30天,ATE AGORA NÃO RECEBI O PRODUTO APESAR DE JÁ TER PAGO,到目前为止，尽管我已经付款，但我还没有收到产品
13d8d37bf20ffee3f1e6e32d7c4d4849,15-30天,A entrega poderia ser mais rapida,交货可能会更快
bdc386da6334df2a3ed8c51f0fe77c16,15-30天,"Não recebi o produto comprado completo. Comprei dois pendentes, mas só entregaram um.
Como faço para receber o restante?","我没有收到完整的购买产品。我买了两个吊坠，但他们只送了一个。
我如何收到余款？"
ba3d396e10bb9cca83f450f0ff8c8dca,0-7天,"O produto foi entregue na casa de um vizinho que eu não tenho contato, como entregam um produto para uma pessoa de outra casa? ",产品送到了我没有联系的邻居家，如何将产品送到另一家的人家？
b0dd307838694a75cf71bf19c41a98cb,8-14天,"Este produto foi entregue correto, mas ainda não avalie sobre sua funcionalidade.",该产品已正确交付，但尚未评价其功能。
6674020dce60ac29b7de0ffa6d2c34e6,>30天,Ainda não chegou! Estou insatisfeita.,还没到呢！我很不满意。
d7ed6c0330486c8239f4fd349450d270,0-7天,Não gostei não véi igual da foto é o material e muito ruim e também veio com defeito mal custura,我不喜欢它，它看起来不像照片，材质很差，而且还有一个缺陷，缝合不好
f26fa27bb0f1337c570d70e32fc2e413,8-14天,Olá boa noite recibi meu produto com à cor errada. Por esse motivo não recomendo à Loja.. ,您好，晚上好，我收到的产品颜色不对。因此我不推荐这家商店。
a966152e4fc6b7e1891aadd4406c7c4a,8-14天,Não veio nenhum desenho no produto e se for só ilustrativo então que tire . Ninguém merece comprar algo por um detalhe é quando chegar não ter esse detalhe. ,产品上没有绘图，如果只是说明性的，请将其删除。当一件东西没有细节时，没有人值得为了细节而购买它。
3ac5f81cae4e0191f17d05323fb9ce6f,8-14天,A kunai e bem frágil na ponta ... Mas meu filho ficou bem feliz com esse presente ! ,苦无的尖端非常脆弱……但我儿子对这份礼物非常满意！
88e06e052985636ec90e5e7337150b62,>30天,"Uma eternidade apenas para separar o produto para a entrega , aí o prazo estimado de entrega se foi faz dias. ",光是把产品分开交付就花了很长时间，预计交付时间还有几天。
d3a3e3dd365abc6013aa6321b0c12c79,8-14天,"Bom dia! O produto chegou dentro do prazo de entrega, porém chegou quebrado, estou tentando falar na loja, mas ninguém resolve.",早上好！产品在交货时间内到达，但到达时已损坏，我一直在尝试联系商店，但没有人可以解决。
c6472cb27f5aea27c6f874ae8928939a,8-14天,Mas o produto não fez efeito nenhum,但产品没有效果
873b10344643e4206c7f04cd54a1fa72,15-30天,O produto não apresentou a qualidade que eu esperava....vou devolver pra loja.,该产品没有达到我预期的质量......我会将其退回商店。
04c5574dca3570ecdde1cf8527993017,8-14天,"Produto chegou antes da data marcada, mas a qualidade é ruim, impressão falhando. A impressora detetou que o cartucho já foi utilizado.",产品在预定日期之前到达，但质量不好，印刷失败。打印机检测到墨盒已被使用。
e51c3cf4bfd09ebd8f6d0174af3ed628,8-14天,SUPER RECOMENDO,强烈推荐
9009f8c050bec7b31063988e925b6da9,8-14天,"Insatisfeita, porque foi entregue faltando 02 panos de prato, vierão somente 05 panos e eu paguei por 07 panos.
Vou fica no prejuízo, mas não compro mais nada... E não recomendo este vendedor.","不满意，因为交付时缺少 2 条洗碗巾，只到了 5 条洗碗巾，我付了 7 条洗碗巾。
我会不知所措，但我不会买其他任何东西......而且我不推荐这个卖家。"
a93517c2ce1c5cf1b4d0f513f712e6dd,15-30天,Cancelei o produto após a compra devido ao prazo de entrega ser 19 dias e chegar após o feriado de carnaval quando iria utiliza-lo,我购买后取消了该产品，因为交货时间为 19 天，并且在我打算使用它的狂欢节假期之后到达。
084e6aea84bfcc0627bf4da8d657938e,15-30天,"Recebi o produto veio tudo okk, mas alguns raladinhos na madeira mas acredito que foi por conta do transporte mas poderia ter sido embalado melhor em um plástico bolha por exemplo. os pés são de ferro",我收到了产品，一切都很好，但木头上有一些划痕，但我相信这是由于运输造成的，但例如，它可以用泡沫包装纸包装得更好。脚是铁做的
ce739db6acc9dd893a9319a2629953e7,8-14天,"Contrariando código de defesa do consumidor. (Lei 8.078. Art.31 ) O relógio não vem com manual em Portugues.Veio em ingles um Xerox meio apagado. Recorri ao You Tube ,onde há demonstrações em espanhol","违反消费者保护法。 （第 8,078 号法律第 31 条）该手表不附带葡萄牙语手册。一份被擦除了一半的英文复印本出现了。我转向 You Tube，那里有西班牙语演示"
bf375386af3b1f89486a565f182219a8,8-14天,"EFETUEI A COMPRA DE 01 CONDICIONADOR AUSSIE MOIST + 01 SHAMPOO AUSSIE MOIST + OS 3 MINUTOS DE TRATAMENTO AUSSIE STRONG.
ME ENVIARAM O TRATAMENTO AUSSIE MOIST SEM SABER A MINHA OPINIÃO.","我购买了 01 澳洲保湿护发素 + 01 澳洲保湿洗发水 + 3 分钟澳洲强力护理。
他们在不知道我的意见的情况下给我寄来了澳大利亚湿敷。"
c2abf9bb9aed7fde704bd9b34802c52a,8-14天,Produto é uma replica. ,产品是复制品。
f58ebdd1a4d270925b85a62286d42e85,15-30天,"Estou devolvendo o produto, no anuncio diz que é 1,40mt o que foi entregue 70cm, não cobre metade do banco do carro.",我正在退货，广告上说它是1.40m，交付时是70cm，它没有覆盖汽车座椅的一半。
09ce65f75711be9f04a63700ae3c5adc,>30天,"Vocês deveriam passar algum contato direto com o fornecedor, minha encomenda ainda não chegou e agora ?",您应该直接与供应商联系，我的订单还没有到达，现在怎么办？
d5a0ba4a296ed948a8c9536f557cedb7,15-30天,"De 3 pendente faltou 2 recebi apenas 1, e não tenho telefone para ligar e reclamar tenho que ir no procon.",3 个待处理中，2 个缺失，我只收到 1 个，而且我没有电话号码可以打电话投诉，我必须去 procon。
f0fc39347a86802c8df13bde9111b01a,0-7天,"É muito pequeno e apertado para os bebês, os bebê n cabem dentro😣 não foi o demonstrava a foto.
Não consigo usar ?","对婴儿来说太小太紧了，婴儿装不进去😣不是照片上显示的那样。
我不能用吗？"
725d5b45e6010a8d3da5106833e22bd0,>30天,"Até o momento não recebi o produto comprado.
Espero que a Americana resolva o mas breve possível.","到目前为止，我还没有收到购买的产品。
我希望美国能尽快解决这个问题。"
52e5445828db681d83dccb33a15ecac4,15-30天,O prazo para entrega é muito longo.,交货时间很长。
a15faf55395d2eb26441175d360c6646,0-7天,"Eu estou com medido de devolução do produto! Esperando as 48hrs que a lannister me pediu....não vou utilizar o produto com meus alunos, baixa qualidade, tecido ruim...liso, costura desfazendo. ",我准备退货了！等待兰尼斯特要求我做的 48 小时...我不会和我的学生一起使用该产品，质量低劣，面料不好...光滑，接缝松散。
1a7dcdf0c1f8c7b57dab8c7378c79cf9,0-7天,"Eu sou cliente de vocês, esse produto foi entregue, no entanto minha outra encomenda está em atraso a 7 dias",我是你们的客户，该产品已交付，但我的其他订单晚了 7 天
e433edc92cb5e3ae5515301b3309e303,15-30天,Esta entrega veio correta mas outra compra da mesma loja veio incompleta e o cartucho era falsificado,这次交货是正确的，但从同一家商店购买的另一笔产品不完整，墨盒是假冒的
947857fc478a90e909d7e3d4b2b9dfb3,8-14天,A logística de vcs demora demais. Tem loja que entrega em dois dias. Fica a dica.,你们的物流时间太长了。有一家商店两天内送货。这是一个提示。
96b997b56a825e2b32a0436cc656b435,15-30天,"O tapete é como descrito, porém veio no tamanho errado. O pedido era 2x2,5 e veio 1x1,5",地毯与描述一致，但尺寸错误。订单为 2x2.5，到达时为 1x1.5
06d74ea6a80deeb7e69a3b1d5bfb9585,8-14天,"comprei a cortina e ela veio com diversos rasgos, estou tentando devolver o produto mas não estou conseguindo.",我买了窗帘，收到时有几处撕裂，我想退货，但不能。
990dd7fbb9ecbada4647e9e05a4739d2,>30天,NÃO RECEBI AINDA O PRODUTO...AGUARDANDO.,我还没有收到产品...正在等待。
0b3407e419ef6be66392971885acce73,8-14天,"Desta vez meu produto não foi entregue corretamente. Pedi e paguei por 4 unidades, mas na verdade recebi apenas 3. Estou no aguardo de um retorno da loja.",这次我的产品没有正确交付。我订购并支付了 4 件，但实际上我只收到了 3 件。我正在等待商店退货。
4baf66d022680c163d31c85a42b6bbd6,8-14天,Produto Travou. Não destrava. 6 dias da compra e agora amanhã é feriado... Como devolver?,产品特拉沃。 Não destrava。购买后 6 天，现在明天是假期...我该如何退货？
1857ec1a182661136fe7584592437d51,8-14天,"Entregaram bem rapido, mais Só não gostei pq veio com defeito (duas manchas ) na cara da boneca.",他们交货很快，但我就是不喜欢它，因为它在娃娃的脸上有缺陷（两个污渍）。
be86cd9f96e674ebdbb586454780a1ea,0-7天,"O produto não é igual ao mostrado na imagem anunciada. Estou esperando o tablet chegar, caso não caiba direitinho na capa, vou devolvê-la.",该产品与广告图片中所示的不一样。我正在等待平板电脑到达，如果它与保护套不合适，我会将其退回。
c1fccaa7401a0afd72cf89d7c2f806df,15-30天,"recebi dentro do prazo e correto, porem poderia ser mais rápido este atendimento.
do resto ok","我准时正确地收到了它，但服务本来可以更快一些。
恢复正常"
5d9b03cb14fe4fbb8f4e9f3de26048f2,0-7天,"Esse produto veio certo ,mas já fiz compra anterior que tive que cancelar o pedido pois já estava com atraso de um mês na entrega.
",该产品正确到达，但我之前购买过，不得不取消订单，因为交货已经晚了一个月。
70ee39a40074e0c39dda6d286a77d5c5,8-14天,"Fiz a compra de 2 toner e foi entregue um de cada vez, porém na nota fiscal do 1° produto constava a entrega de 2 produtos, fiz até uma reclamação referente a produto não entregue. Favor pedir atenção",我购买了 2 个碳粉，一次交付一个，但第一个产品的发票上注明交付了 2 个产品。我什至对未交付产品进行了投诉。敬请关注
b0e40a3e61447dd4231b10489ab96b8e,0-7天,"Não foi entregue o produto que solicitei. Entrei em contato com as lannister e estou aguardando retorno para a troca pelo produto correto, porém ainda não tive retorno das lannister e já está fora d",我请求的产品未交付。我联系了兰尼斯特，正在等待回复，以便我可以将其换成正确的产品，但我还没有收到兰尼斯特的回复，而且它已经缺货了。
00b6e66f005a657a6b13eedcacdf9342,8-14天,"Comprei 2 (dois) Tablet Qbex Zupin TX120 7"" 4GB Dual Core Android 4.2 Preto e recebi apenas 1 (um). A nota fiscal apresenta 2 unidades, mas na caixa lacrada só havia 1 (um). Me considero roubado.","我购买了 2（两）台平板电脑 Qbex Zupin TX120 7"" 4GB 双核 Android 4.2 黑色，但只收到 1（一）台。发票显示 2 台，但在密封盒中只有 1（一）台。我认为自己被盗了。"
